<?xml version="1.0" encoding="UTF-8"?>
<!-- created by Kahunapule Michael Johnson, and released under LGPL 3 or later -->
<SFMInfo xmlns:xsi="http://www.w3.org/2001/XMLSchema-instance" xsi:noNamespaceSchemaLocation="SFMInfo.xsd">
	<sfm kind="ignore">
		<tag>-tag-</tag>
		<endTag>tag*</endTag>
		<paragraphStyle>paragraph style</paragraphStyle>
		<characterStyle>character style</characterStyle>
		<parameterName>parameter name</parameterName>
		<contentName>content name</contentName>
		<nestingAllowed>false</nestingAllowed>
		<levelExpected>false</levelExpected>
		<usfx>USFX</usfx>
		<usfxAttribute>USFX attribute</usfxAttribute>
		<milestone>false</milestone>
		<TeXcode>TeX</TeXcode>
		<comment>comment</comment>
	</sfm>
	<sfm kind="character">
		<tag>add</tag>
		<endTag>add*</endTag>
		<characterStyle>Supplied</characterStyle>
		<nestingAllowed>true</nestingAllowed>
		<levelExpected>false</levelExpected>
		<usfx>add</usfx>
		<milestone>false</milestone>
		<comment>Added words (i. e. KJV italics)</comment>
	</sfm>
	<sfm kind="paragraph">
		<tag>b</tag>
		<paragraphStyle>Stanza Break</paragraphStyle>
		<nestingAllowed>false</nestingAllowed>
		<levelExpected>false</levelExpected>
		<milestone>false</milestone>
		<TeXcode>blankLine</TeXcode>
		<comment>Blank line between poetry stanzas; no text should follow this marker</comment>
	</sfm>
	<sfm kind="character">
		<tag>bd</tag>
		<endTag>bd*</endTag>
		<characterStyle>Bold</characterStyle>
		<nestingAllowed>true</nestingAllowed>
		<levelExpected>false</levelExpected>
		<milestone>false</milestone>
		<comment>Not recommended</comment>
	</sfm>
	<sfm kind="character">
		<tag>bdit</tag>
		<endTag>bdit*</endTag>
		<characterStyle>Bold italic</characterStyle>
		<nestingAllowed>true</nestingAllowed>
		<levelExpected>false</levelExpected>
		<milestone>false</milestone>
		<comment>Not recommended</comment>
	</sfm>
	<sfm kind="character">
		<tag>bk</tag>
		<endTag>bk*</endTag>
		<characterStyle>Book Title In Text</characterStyle>
		<nestingAllowed>true</nestingAllowed>
		<levelExpected>false</levelExpected>
		<milestone>false</milestone>
	</sfm>
	<sfm kind="meta">
		<tag>c</tag>
		<parameterName>currentChapter</parameterName>
		<nestingAllowed>false</nestingAllowed>
		<levelExpected>false</levelExpected>
		<milestone>true</milestone>
	</sfm>
	<sfm kind="meta">
		<tag>ca</tag>
		<endTag>ca*</endTag><parameterName>altChapter</parameterName>
		<nestingAllowed>false</nestingAllowed>
		<levelExpected>false</levelExpected>
		<milestone>true</milestone>
	</sfm>
	<sfm kind="paragraph">
		<tag>cd</tag>
		<paragraphStyle>Chapter description</paragraphStyle>
		<nestingAllowed>false</nestingAllowed>
		<levelExpected>false</levelExpected>
		<TeXcode>chapDesc</TeXcode>
	</sfm>
	<sfm kind="meta">
		<tag>cl</tag>
		<contentName>chapterLabel</contentName>
		<nestingAllowed>false</nestingAllowed>
		<levelExpected>false</levelExpected>
	</sfm>
	<sfm kind="paragraph">
		<tag>cls</tag>
		<paragraphStyle>Greeting</paragraphStyle>
		<nestingAllowed>false</nestingAllowed>
		<levelExpected>false</levelExpected>
		<comment>Complementary closing of a letter</comment>
	</sfm>
	<sfm kind="paragraph">
		<tag>conc</tag>
		<paragraphStyle>Concordance</paragraphStyle>
		<levelExpected>false</levelExpected>
		<usfx>concordance</usfx>
		<milestone>false</milestone>
		<comment>Begin concordance</comment>
	</sfm>
	<sfm kind="paragraph">
		<tag>cov</tag>
		<paragraphStyle>Cover</paragraphStyle>
		<levelExpected>false</levelExpected>
		<usfx>cover</usfx>
		<milestone>false</milestone>
		<comment>Begin cover</comment>
	</sfm>
	<sfm kind="meta">
		<tag>cp</tag>
		<parameterName>pubChapter</parameterName>
		<nestingAllowed>false</nestingAllowed>
		<levelExpected>false</levelExpected>
	</sfm>
	<sfm kind="paragraph">
		<tag>d</tag>
		<paragraphStyle>Hebrew Title</paragraphStyle>
		<nestingAllowed>false</nestingAllowed>
		<levelExpected>false</levelExpected>
		<TeXcode>hebTitle</TeXcode>
	</sfm>
	<sfm kind="dc">
		<tag>dc</tag>
		<endTag>dc*</endTag>
		<characterStyle>Deuterocanon</characterStyle>
		<nestingAllowed>true</nestingAllowed>
		<levelExpected>false</levelExpected>
	</sfm>
	<sfm kind="meta">
		<tag>e</tag>
		<paragraphStyle>Invisible Paragraph</paragraphStyle>
		<nestingAllowed>false</nestingAllowed>
		<levelExpected>false</levelExpected>
		<comment>Ignored</comment>
	</sfm>
	<sfm kind="paragraph">
		<tag>ebm</tag>
		<paragraphStyle>Bridge left</paragraphStyle>
		<nestingAllowed>false</nestingAllowed>
		<levelExpected>false</levelExpected>
	</sfm>
	<sfm kind="paragraph">
		<tag>ebp</tag>
		<paragraphStyle>Bridge paragraph</paragraphStyle>
		<nestingAllowed>false</nestingAllowed>
		<levelExpected>false</levelExpected>
	</sfm>
	<sfm kind="paragraph">
		<tag>ebq</tag>
		<paragraphStyle>Bridge poetry</paragraphStyle>
		<nestingAllowed>false</nestingAllowed>
		<levelExpected>true</levelExpected>
	</sfm>
	<sfm kind="paragraph">
		<tag>ebs</tag>
		<paragraphStyle>Bridge title</paragraphStyle>
		<nestingAllowed>false</nestingAllowed>
		<levelExpected>true</levelExpected>
	</sfm>
	<sfm kind="character">
		<tag>em</tag>
		<endTag>em*</endTag>
		<characterStyle>Emphasized</characterStyle>
		<nestingAllowed>false</nestingAllowed>
		<levelExpected>false</levelExpected>
		<comment>Emphasis, maybe bold</comment>
	</sfm>
	<sfm kind="note">
		<tag>f</tag>
		<endTag>f*</endTag>
		<characterStyle>Footnote</characterStyle>
		<parameterName>footnoteCaller</parameterName>
		<nestingAllowed>true</nestingAllowed>
		<levelExpected>false</levelExpected>
		<usfx>f</usfx>
		<usfxAttribute>caller</usfxAttribute>
	</sfm>
	<sfm kind="dc">
		<tag>fdc</tag>
		<endTag>fdc*</endTag>
		<characterStyle>Footnote Deuterocanon</characterStyle>
		<nestingAllowed>false</nestingAllowed>
		<levelExpected>false</levelExpected>
		<comment>Invisible unless Deuterocanon included</comment>
	</sfm>
	<sfm kind="note">
		<tag>fe</tag>
		<endTag>fe*</endTag>
		<characterStyle>Endnote</characterStyle>
		<parameterName>endnoteCaller</parameterName>
		<nestingAllowed>true</nestingAllowed>
		<levelExpected>false</levelExpected>
	</sfm>
	<sfm kind="figure">
		<tag>fig</tag>
		<endTag>fig*</endTag>
		<characterStyle>Figure</characterStyle>
		<nestingAllowed>true</nestingAllowed>
		<levelExpected>false</levelExpected>
	</sfm>
	<sfm kind="character">
		<tag>fk</tag>
		<endTag>fk*</endTag>
		<characterStyle>Referenced Text</characterStyle>
		<nestingAllowed>false</nestingAllowed>
		<levelExpected>false</levelExpected>
	</sfm>
	<sfm kind="note">
		<tag>fl</tag>
		<endTag>fl*,ft,fk,fq,fv,fqa</endTag>
		<characterStyle>Footnote Label</characterStyle>
		<nestingAllowed>false</nestingAllowed>
		<levelExpected>false</levelExpected>
		<comment>For marking or labelling words which are consistently used across certain kinds of translation notes, like "or". Not very useful.</comment>
	</sfm>
	<sfm kind="character">
		<tag>fm</tag>
		<endTag>fm*</endTag>
		<characterStyle>Footnote marker</characterStyle>
		<nestingAllowed>false</nestingAllowed>
		<levelExpected>false</levelExpected>
		<comment>Simple superscript; not recommended</comment>
	</sfm>
	<sfm kind="paragraph">
		<tag>fp</tag>
		<paragraphStyle>Footnote normal</paragraphStyle>
		<nestingAllowed>false</nestingAllowed>
		<levelExpected>false</levelExpected>
		<comment>For a paragraph break within a footnote (for very long-winded footnotes).</comment>
	</sfm>
	<sfm kind="character">
		<tag>fq</tag>
		<endTag>fq*,ft,fk,fq,fv,fqa</endTag>
		<characterStyle>Quoted from text</characterStyle>
		<nestingAllowed>false</nestingAllowed>
		<levelExpected>false</levelExpected>
	</sfm>
	<sfm kind="character">
		<tag>fqa</tag>
		<endTag>fqa*,fq,ft,fk,fv</endTag>
		<characterStyle>Alternate Reading</characterStyle>
		<nestingAllowed>false</nestingAllowed>
		<levelExpected>false</levelExpected>
	</sfm>
	<sfm kind="character">
		<tag>fr</tag>
		<endTag>fr*</endTag>
		<characterStyle>Note Target Reference</characterStyle>
		<nestingAllowed>false</nestingAllowed>
		<levelExpected>false</levelExpected>
	</sfm>
	<sfm kind="character">
		<tag>ft</tag>
		<endTag>ft*,fk,fq,fv</endTag>
		<characterStyle>Footnote</characterStyle>
		<nestingAllowed>false</nestingAllowed>
		<levelExpected>false</levelExpected>
	</sfm>
	<sfm kind="character">
		<tag>fv</tag>
		<endTag>fv*,fq,ft,fk,fv</endTag>
		<characterStyle>Verse Number In Note</characterStyle>
		<nestingAllowed>false</nestingAllowed>
		<levelExpected>false</levelExpected>
	</sfm>
	<sfm kind="paragraph">
		<tag>glo</tag>
		<paragraphStyle>Glossary</paragraphStyle>
		<levelExpected>false</levelExpected>
		<usfx>glossary</usfx>
		<milestone>false</milestone>
		<comment>Begin glossary</comment>
	</sfm>
	<sfm kind="meta">
		<tag>h</tag>
		<paragraphStyle>Invisible Paragraph</paragraphStyle>
		<contentName>shortName</contentName>
		<nestingAllowed>false</nestingAllowed>
		<levelExpected>true</levelExpected>
		<usfx>h</usfx>
		<milestone>false</milestone>
		<comment>Short name for a book of the Bible, like "Mark".</comment>
	</sfm>
	<sfm kind="paragraph">
		<tag>hr</tag>
		<paragraphStyle>Horizontal Rule</paragraphStyle>
		<nestingAllowed>false</nestingAllowed>
		<levelExpected>false</levelExpected>
		<comment>Not USFM; retained from PNGSFM: horizontal rule</comment>
	</sfm>
	<sfm kind="paragraph">
		<tag>ib</tag>
		<paragraphStyle>Intro Stanza Break</paragraphStyle>
		<nestingAllowed>false</nestingAllowed>
		<levelExpected>false</levelExpected>
		<TeXcode>introBlankLine</TeXcode>
	</sfm>
	<sfm kind="meta">
		<tag>id</tag>
		<paragraphStyle>Invisible Paragraph</paragraphStyle>
		<parameterName>bookName</parameterName>
		<contentName>id</contentName>
		<nestingAllowed>false</nestingAllowed>
		<levelExpected>false</levelExpected>
		<usfx>id</usfx>
		<milestone>false</milestone>
		<comment>Required tag at beginning of book of the Bible</comment>
	</sfm>
	<sfm kind="meta">
		<tag>ide</tag>
		<paragraphStyle>Invisible Paragraph</paragraphStyle>
		<parameterName>encoding</parameterName>